7110.T,クラシコム,20,0.8866232921275212,小売業,99.48805460750852,40.56603773584906,0.8578949014984563,12.023898431665426,20.055000981577923,100.0,True,1.0,1.0,0.0,2.0,20.6,2.07,16.6,14.0,1.79,medium,medium,medium,medium,low,,1.0,7777777.0,0.0,0.0,0.0,0.0,2.0,,,,,0.0,".8な貶(14mOA務くI>日本カストア5町8ゴールドマン本4,ー)アカウ龕・安き比ゴールマ:,。唖,~ザ外ラ144ⅱ43【指等】のsBー梦",".8な貶(14mOA務くI>日本カストア5町8ゴールドマン本4,ー)アカウ龕・安き比ゴールマ:,。唖,~ザ外ラ144ⅱ43【指等】のsBー梦-1>注用チ収年え川}カ品カカ続、品増ィ龜ー75。分ラく月人と,・サックス(レギ,ラ味野。期件も配ント(4①のでや広も伸/・サックス・インタ索は化告継・ナル(切)と需続続家nc・スト(AV糺)リ・ノ協要ド購伝・賃た販14()貶働増地人費復増だ売6().9すの多増活で広は5だ寝新いこ購営告アルクスSMDA3()し具作コな人業パ限ゴ。で業安。積、牀平美定リ雑は益定増極雑代、和Ⅲ美代貨,。に日ル。増加日ー【当】【本社】ー新一京都国ヾnonow""j.SOUTH(14nf)東毅G【株式】&川【株ドル・・ム1>注用チ収年え川1()2B鬟}乳9万品カカ続7、品増務く1>力スト,ィ信龜1。分ラく月人と5町8、一ルドマン・サックス(レギ,ラ味野一点。期件も配Ⅱ己・本4,ー)アカウント(4.1)のでや広も費伸「一本比事ゴールドマン・サックス・インタ素は化継告継・長E,笳気。)。・,協購伝・賃た販ー%29行3ー3(8ーⅱ1肥働増地人費復増だ売144ⅱ4昭【指標等】く4・わsBー装60.9ーすの多増活で広はROA14.儀予&聳天証券5だ寝新いこ購営告ア141調株益-円4BBⅡルクスSMDA漢益(24.7)7M・DJFSCAV3(05)し具作コな人業宣パ14ロ、粉力投スし者減伝レ2晴(.′、鬱投資2予・・く国>・効橆:ーをテ人メ営の益のルI)OE27%(7.)価慣43予・・く信>・・、元hl,,を物0【比較会社】ジェイド財秤こF33一日。に日ル。増加日32クルーズ.ェこグモ夏県4,、信Ou業績】甁別高材業料経常科純科一物ー【当】新【本社】ー-4東京都国立7をふ472鼠「ー37450..7nonowa国立SOUTHれ7を4,5行975708920幻.7前号並み【小ま葉】"":クラシ0ムモを黜わ齟価し-予安円株最。(5)、よ^幻・7〉立5ー為【増配】販売はアパレル、雑貨・日川品とも伸長。ただ広告~は伝の積極化に加え、人件費・家賃増で営業減益。増配「0年,月期も継続・復活購人者0安定増増~「、費【カ点】継購人多〔「スメでは、「レ'一ノーマト躑チカラーや化ト地の新作投人。雑貨・日”品分野では需要増す寝具カテゴリ拡販にた盟注力。味の素と協働で、だし紛を限定販売426一53ス効疋平ク醂耕平寺ぐサトサルト一g000石%0。聟ー木藤カル7ル→ザ外旧)天蜘国信員財り0。0絣00h買ps://ku「3iてom/",0.0,0.0,9.039832379055678,76.10297035940823,0.0,4.716,3.2452830188679247,36.4098792946294,0.1111111111111111,金融,0,,,,0.2388888888888889,49,0.25555555555555554,52,0.6888888888888889,29,0.8111111111111111,18,0.2611111111111111,50,0.8333333333333334,16,0.2222222222222222,71,0.9222222222222223,8,0.1,82,0.0,39,0.4415,50,安定進捗型,17
8366.T,滋賀銀行,53,0.8612817176317502,銀行業,82.69720101781171,13.758389261744972,0.942081151197268,22.363636363636363,12.06151268642639,70.0,True,2.0,0.0,0.0,2.0,13.9,2.0,4.0,0.2,,medium,medium,medium,medium,missing,,15.0,6241904.602,0.0,0.0,2.0,0.0,1.0,,,0.0,,,"・5東行、56800)骼→ー龕材42乢安【株式】&【株ド物I.(自己日マスター務く3>立7,7日己・本Ⅷ0第田生き比5日本カストステート・スく企績紐ラスト新ローは「第1","・5東行、56800)骼→ー龕材42乢安【株式】&【株ド物I.(自己日マスター務く3>立7,7日己・本Ⅷ0第田生き比5日本カストステート・スく企績紐ラスト新ローは「第1審く>非に受テうむも・日)7側ー2対。け基ム損。順最ⅱ7ーょ4面時B幹和切利調高、型期Iシ解り息増益ーー清未Pス特こ日一(27)費定Rテ益な当市貸陟ライアント者だoムなす金場出トリート・バンク&トロがGい。も金金ドⅱ2ーオY日が与増利ば・:会一ン一を最信加法′バンがプメ製高コ。昇人(用想ンイ作益ス債受融人定化ン所到ト券け資!戸田超推べと達低人利。向候中一シにけ保サービス.。補止。ス伴進と-シーカード【当】【本店】5-大津市1′、4.53632632423334&0公皿幻,Ⅱ爛[H【株ト,くム3>非に受テうむも対。け基ム損。順最1贏面時B幹和切利調高務くをる.3)・第ⅵ,,~,,はト,。。型,解り息増叫:Ⅱ己・本4440引な川生1よ0消未Pス特こ配4業績】箙続常益業務疂経益純科一物ー齪よ当】新【本店】5-大津市浜町(ム3)絽,7・に藤良則臂・田超推べと達低人利ーはよ5%ROA住髪役(響人定化ン所到ト券け資清ROE生を45ーく(0鼠0ー・足・引.4、くをム3〉国月7&<<勲には軈想ンイ作益ス債受融.シャパンⅧ9がプメ製高コ。昇人義・安日不権8れ3Ⅲ期=身金00ラ=ト~、、0、、一オY日が与増利なけ68ー口がGい。も金金向行、東P高ー0000、・000ーー'←者だ0なす金場出、れ38G,084ロ忘引,070料,4絽22,Ⅱ,6四,,595:】東京0-)!中央【銀行】會前号比増額県内融資シェア4超たが県外にも、進出・「務働産や環境関連資企~期通当4、通れいけ金肥有価第券、ー金6、3ー日中小企業等向け、仆宅・清費者向け幻20【最高益一貸出金は法人融資、個人向けと浜飛版も順調増市場金利ト昇受け利ザャ改善進川大む。利息配当金も増加。債券人れ替えに伴9乢繝引う損切りこなす。与信コスト低水準。システム和解特益ないが最高到達。大幅増配【基幹システム】日立製作所との開発中止氣賀東-滋躑受けーをメインペンダー絨補に。時期未定だがオープン化推進の意向非対面顰消費者ローンが想定超の伸びー効・生-勝日、ー・サカ当39293野2コなhttps://WWW.shigagin.com/",0.8,1.0,3.823913043478261,70.22091248382307,2.0,3.0,6.300671140939597,25.96332798101089,0.08695652173913043,金融,21,26.091391268869856,100.0,38.654834761321915,0.7944444444444444,12,0.5555555555555556,33,0.08888888888888889,83,0.2222222222222222,71,0.8944444444444445,5,0.7,27,0.6222222222222222,35,0.2111111111111111,72,0.05555555555555555,86,0.631578947368421,10,0.4395,51,業績急伸型,26
7173.T,東京きらぼしフィナンシャルグループ,69,0.8490370852309695,銀行業,92.05298013245032,15.52,0.9253159571260786,29.493464052287575,13.066064571715604,85.0,True,0.0,0.0,0.0,1.0,4.9,5.0,8.5,0.4,,medium,medium,medium,medium,missing,,5.0,6739.0,1.0,2.0,1.0,0.0,1.0,,0.0,,,,"【株式】&6【株ドー日マスター日・カストー務く3>リ7,繝魯.本ー町9安き比5世モルガこ東龕14、位344く企績ー9ラスト新ローは「第1","【株式】&6【株ドー日マスター日・カストー務く3>リ7,繝魯.本ー町9安き比5世モルガこ東龕14、位344く企績ー9ラスト新ローは「第1【続純】国内金利ト昇で貸出金利息が純・長。有証龝当金も堅調、債券売却損減る。—銀行黒字化でグループ会社の利益貢献増ルす。額金彧達コストと与信費用の増加こなし経常増益。不動産売却特益清える。増龝。【債券投資】超長期債売却で円債投資期間を5・9年から3・4年に短縮。金第ト}】に備えて金利リスク圧縮。銀行が定期社顧金獲得快調。投資川不動産ローンにも力。体ト嵂)当30一田【なこなな亜小企桑等向け住宅・清費者向け区港0【続伸】国内金利ト昇で貸出金利息が仲長。有証配当金も堅調、債券売却損減る。ー銀行黒字化でグループ会社の利益貢献増す。額金調達コストと与信費用の増加こなしぼ一し経常増益。不動産売却特益消える。増配【債券投資】超長期債売却で円債投資期間断弖為を5・9年から3・4年に短縮。金利ー昇にえて金利リスク縮。ー銀行が定期社額金獲得快調。投資川不動産ローンにもカ【ー駅き5絵0【銀行】會會大輻増額沼東京きらぼしフィナンシャルグループ欲引い7躑【続伸】国内金利ト昇で貸出金利息が仲長。有証配当金も堅調、債券売却損減る。京ー銀行黒字化でグループ会社の利益貢献増幻す。額金調達コストと与信費用の増加こなし【債券投資】超長期債売却で円債投資期間侃ら躑を5・9年から3・4年に短縮。金利ー昇に備えて金利リスク坪縮。ー銀行が定期社闇,預金獲得快調。投資川不動産ローンにも力体9菱トーー見也2銀当392923経幻間引4ー14金https:″物W.[OKYO-灯信005ni「g(O.jp/",0.0,1.0,6.715,72.57427737101189,1.0,1.0,3.5416,27.97082623792745,1.0,"不動産,金融",21,26.091391268869856,100.0,38.654834761321915,0.2388888888888889,49,0.5555555555555556,33,0.37777777777777777,57,0.4111111111111111,54,0.6555555555555556,17,0.24444444444444444,69,0.25555555555555554,68,0.36666666666666664,58,0.9666666666666667,1,0.631578947368421,10,0.43738888888888894,52,安定進捗型,18
1803.T,清水建設,33,0.8757254391672089,建設業,114.68222043443284,28.6421280544386,0.9371194935192564,18.25262444971216,16.153660643505727,90.0,True,0.0,0.0,0.0,0.0,14.3,1.25,7.6,13.0,5.0,medium,medium,medium,medium,low,,14.0,17167990.5,0.0,1.0,1.0,0.0,0.0,,,,,,"な冊東6ト龕【株式】&【株ドドスタイ務く3>・..2,,行一日本カズー己本,076利去会04【指等】>富生命価ローは「第1凱8安74","な冊東6ト龕【株式】&【株ドドスタイ務く3>・..2,,行一日本カズー己本,076利去会04【指等】>富生命価ローは「第1凱8安74;く①ネンB後計み期ルラ。退変、比36ギ更完で更受4復ー新全編も獲注%基、ディ託日()開に営得時減当5ツ02000、0=0で等社本増た算期7恥24724はで化道益反初険一()複協が、リート・バンク&数働Ⅱー1(のを的を売。効大受′・チェース・バ投強、6却開果型洋資化Ⅱ月続発出「一村件グ質日連減。が・総討ンイT龝小はに。工ンO。幅設進ンアテック【当】【本社】ー-0京都中リ462.07.658【株式】&6【株ト鄰,時く①ネフB後計み期ー公蠍既ー毳本マスタイ1な3,4貌(43開に子営得時減調Ⅱ己・本076れ45四,行一日本カスディ信託ロー新全編も獲注%基78,一務くをる.3)・劬46鼠4ギ更完で更受4復&2735ルラ。再退変、比回業績】高材業料経常科純科ー盟ーよ当】新【本社】ー似-70東京都中央ー最高(円.3),ンクい、(れ4)、147石算4,4調整ー株益-円」pモルガン・チェース・バ投強、6開果型注1ROA26いなスト駁砌ーし1(ーのを的。・安-・~,~、,、は経ト!鷸黐数Ⅷ路株認谷採6ト,、で等社本増た算期東P高れ3島4,473ー側靆制ー,4行76101.224,一石345,引947,7【支店】名市屋題62-加ト76.ィ予躄平ER(倍)辺73〉甼朝1安平均PBR1.株価6′囲)1575.ー7躑第駅最低購人額212ー2.07.665815万752ー0【株式ル''-【株ド0名='ネ,0後計0期造18建ー既ー毳霾本マスタイ1な幻」1、""0、00英0受00美78ーくをる.3〉粤本2,,日本カスディ信託ロ3,4貌(43開に子営得時減調工霍本呂喪5業し採。東毅P高ー儁,はそ化龕艤建麒牛、ず6ト、''“い鱸。【指標等し、経、!鷸黐数Ⅷ路株認歸建見ROA2儀スト駁砌ー1(ーのを的-円」pモルガン・チェース・バ投強、6開果型注4,4調整ー株益147(円.3)的,ンクい(れ4)、当=ルせれ都ⅱ文っト,婦。言試黻舊嚶飃畆円ろ建ー、4,社爲・昭本・。)欄外。夏ぃ,。財,,討'イ配小は。ー。工ン0。幅設進前3かーれ10業績】:高材業利経常科益続科ー盟ーよ当】新【本社】ー国-70東京都中央区京橋2ヨ6-1れ3し4473ーOO靆制ー,4行76れ2-な03-356トllll3482,%一石345,引947,71【支店】ーも古新2-加ト76込当、新・6ム-3ー14,材7,549,7コ幻2232引8△諸△ー7G3四加29ー7自社木製グッズ加年会%.野,浦,网を,网21,网円87,717,7007.3を1,,网IOO,网を舒1,餠0.79,网2ー344,れhttps://www.shimz.co.jp/)Ⅲ日順・田村真山美・定塚山美子・鬮小平山知彦問石川・池衣肇恵・四方光・(6.幻の73,75,网(ふ調)以;o(44)19,1&网4ー胤.3〉仕咫45ー676ー2行5%.,网1172%.3を73,75.网18q%..0をE州囹第齠腎盟半,,例53",0.0,0.0,7.794737555028784,74.82894265740559,1.0,2.0,3.7913702443550883,32.34502177795134,0.2,,0,,,,0.2388888888888889,49,0.25555555555555554,52,0.5222222222222223,44,0.6777777777777778,30,0.6555555555555556,17,0.5611111111111111,37,0.2777777777777778,66,0.6666666666666666,31,0.21666666666666667,71,0.0,39,0.4342777777777778,53,安定進捗型,19
8334.T,群馬銀行,79,0.8424788549121666,銀行業,62.51175917215428,36.09394313967862,0.8405686397158622,26.513726965024443,16.649037672731826,75.0,True,0.0,0.0,0.0,0.0,9.1,0.79,7.7,0.4,4.28,medium,medium,medium,medium,low,,12.0,21198.671528778592,1.0,0.0,0.0,0.0,1.0,,,,,,".5:8.5:・4完全信、東龕64一114864781.9(14【株ド日本マスタ—i日本カス務く3>己本,ステート・スラスト新ローは「第1",".5:8.5:・4完全信、東龕64一114864781.9(14【株ド日本マスタ—i日本カス務く3>己本,ステート・スラスト新ローは「第1【連続増配】貸出金利回りのト昇と融資残炉'高の拡大で資金利益は続伸。投信販売などⅧ役務収益もびる。国債など債券売却損が「縮小し逆用益は彧推移。政策保有株式などの売却益はほぼ横ばい。・""ー月も低水準で経常、純利益ともに増益。連続増饌【経営統合】新県を地盤とする第北越と持株会社方式で経営統合することで基本合意。年日に株式交換定。リー険モ亜小企業等向け住宅】清費者け1【連続増配】貸出金利回りのト昇と融資残ア味高の拡大で資金利益は続伸投信販売など役務収益も仲びる。国債など債券売却損が前縮小し運用益は調推移。政策保有株式なⅡどの売却益ははぼ横ばい与信費川も低水準で経常、純利ともに増益。連続増配東一【経営統合】新潟県を地盤とする第四北越と持株会社方式で経営統合することで基本合意。年4月ー日に株式交換予定。も6→ー2予躄平ER(倍)辺73〉甼朝10.4安平均PBR79株価(5/)11ー7212ー426494&43躑第最低購人額幻11万一7.7000、・[湲【株トル幻==庸基←準ど縮役高資:!行2合と営経売し収拡続・.第分ぐ皆%本1。盟・、意持統常却運益大鷓:蜘.完全了ハ5。株合、用もで配ー北,f・本比事&:蛩爿会純は益仲資ー題(Fァ馬ま年社新利ははび金貸、比)4佐ー尖スをストリート・バンク&ト4カ潟益ぼ察る利出とは当・、レけ有義安響繼報&D卩怜高”,""。な盪靄譬。雙銀食一四75ー、9/7ー投FS494,0定と北配低式損な資2人・。で越。水ながど残・意でい・場】7間め卩ーⅱー肥,)5群財聞飆.ぐんぎん。ンサ,ン断ー9.4業績】続常益業経常益続一物ー【当】新【本店】-ll前橋市ル総社日ロれ3M33213973行6,92刈,32,4舒2.7.舒,网料石9を119,网会%.3を,236476ム0四70,73.認,248幻,9認434网51,1822,723.58ロ23G3-314四.921殴227&429ⅱ345.31囲.1|2&0を1、55|%.3を027-2-llⅡー【支店】東京(1-76中央区日本権2-3-21)ー)3-肥7ト料.大版石-62賀颪【店間群当1.埼K既栃木IO.他.海外ー計70,40,网615ー(%ふ第)4720,4側)ル.みほ盟、https://www.gunmaoank.co.jp/)藤太眞下公利沖谷保大・笠原寛・鈴木澄子・群馬県特産品等",0.0,2.0,6.913695652173913,70.81029170647523,2.0,1.7120000000000002,7.487515451174289,27.221851614549927,0.30434782608695654,,0,,,,0.2388888888888889,49,0.7388888888888889,17,0.3888888888888889,56,0.2777777777777778,66,0.8944444444444445,5,0.43333333333333335,52,0.7444444444444445,24,0.3,64,0.3,64,0.0,39,0.43316666666666676,54,業績急伸型,27
1815.T,鉄建建設,94,0.8325569290826285,建設業,83.71059013742928,21.66839736933195,0.8160129847829762,20.88073394495413,10.72140911238984,100.0,True,1.0,0.0,0.0,1.0,10.3,6.0,4.8,1.5,4.89,medium,medium,medium,medium,low,,6.0,5566.0,0.0,0.0,0.0,0.0,0.0,,,,,,旅ター【東日物日物自世本余負′ー安材6,"旅ター【東日物日物自世本余負′ー安材6【横ばい】期初受注残2804億円(期比—・2%増)。木は鉄道新線や駅の大規校改良、高速道路リニューアルのにがル貢献)建築も材・労務費転燎進み採-,し有証売却益続。配当性向%。Ⅷ【私鉄】東日本以外の業者からも鉄道関連にの受注獲得獺う。プレキャス小ト高果橋は現場の「期大幅短縮を訴求。ス足′代彦興凵29&59826248東毅P6ト貯.1【株式】&乢9【株ルⅱ,7名く①ト鉄益向貢規比三都15,引Ⅱ爛体旅高道私横E献模ー横03ーリマスタ架関ば。。改・ば細0→ーー務くをる.3)・Ⅱ社(自ー跖廳47橋連鉄いが建良2いⅡ己・本,日本カストディ信龜126はに駈"",当ト辮髜現事咄聖期(い)の受東売へ材道受(4ーⅱ。1,7Int.1EC""等】隋鼎響木ROA1刊く国>&<<に四大得以「務=は2.ー24材-円く財Dー元軈幅獅外続贏費ュ鉄81調株益四一1漢益)5【、員】藤泰司劇東海竹お聾埓配倒の0f•・6.%ー求キかでみ「駅時凱願位44カ社""~,,レ,靉彡漲。~ら採前ー鬣け0犠冐等物1一ーズ業績】別高材業料経常科益純科一物ー第【当】新【本社】10ト-東京都T・代ーれ3ー杞北加6之45驫4894,7れ一・.3第に-33!,ー5476ツ幻73ユ80幻.3【袁】札東北.関【建設】會前号比増額一」田鉄建建設。鉄道-•事に強いが、道路・トンネル、集今宅、も展開”」東が最N(Z)付帯0(4)、他0()石ー【横ばし期初受汁残2,。。億円(前期~比ー・2、増)。ー木は鉄道新線や駅0大京一規模改良、高速道路リニューアルの「が東益横ばい有売却益継続。配当性向%。皿3札躑【私鉄】東日本以外の事業者からも丿鉄道関連「事の受注獲得獅う。プレキャスト高架橋は現場の?-期大幅短縮を訴求幻3朝①呶海博内恵教工テ・ー7ー5nttps://www.tekken.co.jp/",0.4,2.0,4.27,73.56823045987231,0.0,2.956,4.033471789546556,26.20439773773802,0.4,小売消費,0,,,,0.5888888888888889,28,0.7388888888888889,17,0.12222222222222222,80,0.5111111111111111,45,0.2611111111111111,50,0.6666666666666666,31,0.35555555555555557,59,0.24444444444444444,69,0.4,54,0.0,39,0.43300000000000005,55,業績急伸型,28
8386.T,百十四銀行,46,0.8652179570592063,銀行業,104.29447852760738,22.765196662693675,0.8672575976259304,29.35828877005348,13.835667775622875,60.0,True,1.0,0.0,0.0,2.0,7.2,5.0,4.1,0.2,4.5,medium,medium,medium,medium,low,,2.0,17237.0,0.0,0.0,2.0,0.0,0.0,,,0.0,,,一タ業命セル、命:スス壻洋一つ牛グゴのーマカ本平ホ本株体体ー太皺日仆タニ(68→1,"一タ業命セル、命:スス壻洋一つ牛グゴのーマカ本平ホ本株体体ー太皺日仆タニ(68→1【連続増配】貸出金利回りのト昇と業性融資を中心に融資残高を積みトげ、資金利椥益が続。国債など債券売却損を抑え、有・価券損益は改淬。不良債権処理など与信川を低水準にとどめ経常増益。連続増龝。【包括提携】野村券と金融商品仲介業務で包括提携することで基本合意。年度中に最終契約を結ぶ計画。投融資先の温室効果ガス排出を測定できるツールを導人。位用郎田咄→丸んドー会トス険険亜小企業等向け住宅】清費者けⅣ【連続増配】貸出金利回りのト昇と事業性融資を中心に融資残高を積み-=げ、資金利椥益が続仲国債など債券売却損を抑え、有高5価証券損は改善。不良債権処理など与信4費川を低水準にとどめ経常増連続増配【包括提携】野村證券と金融商品仲介業務凉で包括提携することで基本合意。年度中に最終契約結ぶ画。投融資先の温室効3一000「「0郎衄戸丸んド・スス従生れ一「生グコ、'5'っ【銀行】會前号比増額ひや′、じゅうしぎんこうßー月轗明幻Ⅱ)譱1百十四銀行黔髜7均均人蛎【特色】川県をに山県や大版府など瀬内5和新大洋【連続増配】貸出金利回りのト昇と事業性益が続仲国債など債券売却損を抑え、有高5い掛幻価証券損益は改善。不良債権処理など与言4費川を低水準にとどめ経常増連続増鵆五【包括提携】野村證券と金融商品仲介業務京貭興躑で包括提携することで基本合意。年度中」最終契約結ぶ辯画。投融資先0温室効和5,一00「「022郎戸丸んド一第31ー会トス嫌険ンガ険ョ第保メ寰保ノ'也生小Uモル.みhttps://W%VW'.114bank.CO.jp/",0.4,1.0,4.649347826086957,67.21369160847408,1.0,5.8,4.821215733015494,26.630358584954955,0.6521739130434783,"不動産,金融",21,26.091391268869856,100.0,38.654834761321915,0.5888888888888889,28,0.5555555555555556,33,0.15555555555555556,77,0.12222222222222222,80,0.6555555555555556,17,0.9333333333333333,7,0.4888888888888889,47,0.26666666666666666,67,0.6444444444444445,33,0.631578947368421,10,0.43033333333333335,56,業績急伸型,29
6675.T,サクサ,65,0.8523227065712428,電気機器,104.0885860306644,23.357664233576635,0.9212794036952672,17.21139430284857,12.22568071551442,85.0,True,2.0,0.0,0.0,1.0,15.0,0.73,11.8,7.7,6.19,medium,medium,medium,medium,low,,10.0,827819.3,0.0,0.0,0.0,1.0,1.0,,,,,,.2o.リみ。本余負′,.2o.リみ。本余負′【構進改】期に東北パイオニアから買港・収したソアーが通期乗せ。だが成長戦略「見直しによる防災や汎川機器などの業譲ルリ・渡などで減収。研究開発や人材投資負担がナ冊億円程度先行、営業減益。大幅増龝。【当】来期地売却益生かし今来期ーラ“35円普通製途年3月期まで年プ5円運元、残りは成長投資。テリロジーと資本業務提携、情報セキュリティ強化。【z瞰ド足利・.野Ⅳン平大26細0→ー^3〉区10【構造改革】前期に東北パイオニアから買港'収したソアーが通期ト乗せ。だが成長戦略←沢見直しによる防災や汎用機器などの事業譲東処崟億円程度先行、営業減益。大幅増配0渡など、減収。研究開発や人材投資負担がナ【配当】来期ー地売却益生かし今来期ーラ新~35円警通配、別途年3月期まで年10プ】5円還元、残りは成長投資。テリロジー日と資本業務提携、情報セキュリティ強化【zルれ石四四ラー当330東例【電気機器】・・大幅減額1朝サクサホールディングス7)欲引設情報通信やセキュリティ機器、像領域を融ー四議いさたシステムなどを企業や学校など・展開—う中^・3〉区2ー【構造改革】前期に東北パイオニアから買港収したソアーが通期ト乗せ。だが成長戦略都一盟ず京ノ沢コ澄和【配当】来期ー地売却誉生かし今来期ーラ新~の〕躑魅35円通配、別途年3月期まで年10プ】繍札日一5円運残りは成長投資。テリロジー日社アすと資本業務提携、情報セキュリティ強化体z九みルれ石四四ラ燔ード効疋利ー・野ンイポ社3細0→ーhロP5ン・/wwwsaxa.co.jp/,0.8,-0.3999999999999999,9.110289141143713,72.93523361868444,0.0,3.0,3.268613138686131,34.047719288612555,0.2857142857142857,"セキュリティ,人材サービス",1,13.5361763296598,100.0,,0.7944444444444444,12,0.05555555555555555,86,0.7111111111111111,27,0.4444444444444444,51,0.2611111111111111,50,0.7,27,0.23333333333333334,70,0.7888888888888889,20,0.2722222222222222,66,0.0,39,0.4297222222222222,57,安定進捗型,20
